{
  "schemaVersion": 2,
  "publishedVersion": "2026.10.12.1",
  "revision": 2,
  "minimumAppVersion": "0.5.0",
  "assets": [],
  "constellations": [
    {
      "id": "conjuntos",
      "version": 1,
      "order": 1,
      "area": "logic_and_sets",
      "title": {
        "es": "Conjuntos",
        "en": "Sets"
      },
      "description": {
        "es": "Agrupa, compara y combina conjuntos.",
        "en": "Group, compare and combine sets."
      },
      "visual": {
        "coverAssetId": null,
        "accentColor": "#8CCDFD"
      },
      "levels": [
        {
          "id": "conjuntos-elementos",
          "version": 2,
          "order": 1,
          "title": {
            "es": "Elementos",
            "en": "Elements"
          },
          "instruction": {
            "es": "Elige las estrellas",
            "en": "Pick the stars"
          },
          "mechanic": {
            "type": "set_select",
            "schemaVersion": 1,
            "config": {
              "attempts": 2,
              "successFeedback": {
                "es": "¡Muy bien! Esos son los elementos.",
                "en": "Great! Those are the elements."
              },
              "retryFeedback": {
                "es": "Mira bien la forma y el color.",
                "en": "Look closely at the shape and the color."
              },
              "rounds": [
                {
                  "prompt": {
                    "es": "Elige las estrellas",
                    "en": "Pick the stars"
                  },
                  "pieces": [
                    {
                      "shape": "star",
                      "color": "yellow"
                    },
                    {
                      "shape": "moon",
                      "color": "cyan"
                    },
                    {
                      "shape": "star",
                      "color": "yellow"
                    },
                    {
                      "shape": "gem",
                      "color": "purple"
                    },
                    {
                      "shape": "moon",
                      "color": "cyan"
                    },
                    {
                      "shape": "star",
                      "color": "yellow"
                    }
                  ],
                  "target": {
                    "shape": "star"
                  }
                },
                {
                  "prompt": {
                    "es": "Elige las lunas",
                    "en": "Pick the moons"
                  },
                  "pieces": [
                    {
                      "shape": "star",
                      "color": "yellow"
                    },
                    {
                      "shape": "moon",
                      "color": "cyan"
                    },
                    {
                      "shape": "gem",
                      "color": "purple"
                    },
                    {
                      "shape": "moon",
                      "color": "cyan"
                    },
                    {
                      "shape": "circle",
                      "color": "blue"
                    },
                    {
                      "shape": "moon",
                      "color": "cyan"
                    }
                  ],
                  "target": {
                    "shape": "moon"
                  }
                },
                {
                  "prompt": {
                    "es": "Elige lo morado",
                    "en": "Pick the purple ones"
                  },
                  "pieces": [
                    {
                      "shape": "gem",
                      "color": "purple"
                    },
                    {
                      "shape": "star",
                      "color": "purple"
                    },
                    {
                      "shape": "moon",
                      "color": "cyan"
                    },
                    {
                      "shape": "circle",
                      "color": "purple"
                    },
                    {
                      "shape": "star",
                      "color": "yellow"
                    },
                    {
                      "shape": "circle",
                      "color": "blue"
                    }
                  ],
                  "target": {
                    "color": "purple"
                  }
                },
                {
                  "prompt": {
                    "es": "Elige los círculos azules",
                    "en": "Pick the blue circles"
                  },
                  "pieces": [
                    {
                      "shape": "circle",
                      "color": "blue"
                    },
                    {
                      "shape": "circle",
                      "color": "yellow"
                    },
                    {
                      "shape": "star",
                      "color": "blue"
                    },
                    {
                      "shape": "circle",
                      "color": "blue"
                    },
                    {
                      "shape": "moon",
                      "color": "cyan"
                    },
                    {
                      "shape": "circle",
                      "color": "pink"
                    }
                  ],
                  "target": {
                    "shape": "circle",
                    "color": "blue"
                  }
                }
              ]
            }
          },
          "unlock": {
            "prerequisiteLevelIds": []
          },
          "completion": {
            "type": "minimum_score",
            "value": 60
          },
          "reward": {
            "experience": 50,
            "badgeId": null
          }
        },
        {
          "id": "conjuntos-pertenencia",
          "version": 2,
          "order": 2,
          "title": {
            "es": "Pertenencia",
            "en": "Membership"
          },
          "instruction": {
            "es": "¿Pertenece al conjunto?",
            "en": "Does it belong to the set?"
          },
          "mechanic": {
            "type": "set_membership",
            "schemaVersion": 1,
            "config": {
              "attempts": 2,
              "successFeedback": {
                "es": "¡Correcto! Revisaste el conjunto.",
                "en": "Correct! You checked the set."
              },
              "retryFeedback": {
                "es": "Busca la pieza dentro del conjunto.",
                "en": "Look for the piece inside the set."
              },
              "rounds": [
                {
                  "set": [
                    {
                      "shape": "star",
                      "color": "yellow"
                    },
                    {
                      "shape": "gem",
                      "color": "purple"
                    },
                    {
                      "shape": "circle",
                      "color": "blue"
                    }
                  ],
                  "candidate": {
                    "shape": "moon",
                    "color": "cyan"
                  }
                },
                {
                  "set": [
                    {
                      "shape": "moon",
                      "color": "cyan"
                    },
                    {
                      "shape": "star",
                      "color": "yellow"
                    },
                    {
                      "shape": "circle",
                      "color": "pink"
                    }
                  ],
                  "candidate": {
                    "shape": "star",
                    "color": "yellow"
                  }
                },
                {
                  "set": [
                    {
                      "shape": "gem",
                      "color": "purple"
                    },
                    {
                      "shape": "circle",
                      "color": "yellow"
                    },
                    {
                      "shape": "moon",
                      "color": "cyan"
                    },
                    {
                      "shape": "star",
                      "color": "blue"
                    }
                  ],
                  "candidate": {
                    "shape": "star",
                    "color": "yellow"
                  }
                },
                {
                  "set": [
                    {
                      "shape": "circle",
                      "color": "blue"
                    },
                    {
                      "shape": "gem",
                      "color": "pink"
                    },
                    {
                      "shape": "star",
                      "color": "yellow"
                    }
                  ],
                  "candidate": {
                    "shape": "gem",
                    "color": "pink"
                  }
                }
              ]
            }
          },
          "unlock": {
            "prerequisiteLevelIds": []
          },
          "completion": {
            "type": "minimum_score",
            "value": 60
          },
          "reward": {
            "experience": 50,
            "badgeId": null
          }
        },
        {
          "id": "conjuntos-subconjuntos",
          "version": 2,